{
  "schema_version": "1.0.0",
  "correlation_id": "11111111-1111-4111-8111-111111111111",
  "source_id": "22222222-2222-4222-8222-222222222222",
  "external_id": "post-123",
  "canonical_url": "https://example.org/results/post-123",
  "dedupe_key": "post:post-123",
  "published_at": "2026-09-06T02:00:00Z",
  "retrieved_at": "2026-09-06T03:00:00Z",
  "title": "Example match result",
  "normalized_text": "Bull A defeated Bull B at Example Venue.",
  "raw_metadata": {
    "language": "th"
  },
  "evidence": [
    {
      "evidence_type": "TEXT",
      "storage_ref": null,
      "source_ref": "https://example.org/results/post-123",
      "content_sha256": null,
      "text_excerpt": "Bull A defeated Bull B",
      "timestamp_start_seconds": null,
      "timestamp_end_seconds": null,
      "access_class": "PUBLIC_REFERENCE",
      "metadata": {}
    }
  ],
  "connector": {
    "name": "example-web",
    "version": "1.0.0"
  }
}
